{
  "schema_version": "1.0",
  "student_ref": "stu_Mv4Rt7Jc2Pa9Dx6L",
  "generated_at": "2026-10-24T18:00:00Z",
  "timezone": "America/Phoenix",
  "window": { "start": "2026-10-27T00:00:00Z", "end": "2026-10-31T23:59:59Z" },
  "disclosure_level": "category",
  "slots": [
    { "start": "2026-10-27T21:00:00Z", "end": "2026-10-27T23:00:00Z", "state": "busy", "category": "academic" },
    { "start": "2026-10-29T15:00:00Z", "end": "2026-10-29T16:00:00Z", "state": "busy", "category": "personal" }
  ],
  "redactions": 0
}
