{
  "schema_version": "1.0",
  "student_ref": "stu_7Kp2Qm9Xr4Lt8Vn3",
  "generated_at": "2026-10-24T18:00:00Z",
  "timezone": "America/Phoenix",
  "window": { "start": "2026-10-27T00:00:00Z", "end": "2026-10-31T23:59:59Z" },
  "disclosure_level": "free_busy",
  "slots": [
    { "start": "2026-10-27T21:00:00Z", "end": "2026-10-27T23:00:00Z", "state": "busy" },
    { "start": "2026-10-28T17:00:00Z", "end": "2026-10-28T19:00:00Z", "state": "free" }
  ],
  "constraints": { "earliest_hour": 9, "latest_hour": 21, "min_duration_minutes": 60 },
  "redactions": 3
}
